{
    "protocolVersion": 2,
    "kind": "request",
    "id": "request-2",
    "command": "node.set_property",
    "params": {
        "scene": "res://levels/first.tscn",
        "node": "Player/Sprite2D",
        "property": "position",
        "value": {"type": "Vector2", "value": [64, 32.5]}
    },
    "expectedRevision": 7
}
